<?xml version="1.0" encoding="UTF-8"?>
<botiga
        xmlns:xsi="http://www.w3.org/2001/XMLSchema-instance"
        xsi:noNamespaceSchemaLocation="botiga.xsd">
    <producte id="p1" categoria="electronica" moneda="EUR">
        <nom>Portàtil ASUS</nom>
        <marca>ASUS</marca>
        <preu>749.99</preu>
        <stock>15</stock>
        <etiquetes>
            <etiqueta>informatica</etiqueta>
            <etiqueta>oferta</etiqueta>
        </etiquetes>
    </producte>
    <producte id="p2" categoria="roba" estat="esgotat" moneda="EUR">
        <nom>Samarreta bàsica</nom>
        <marca>Zara</marca>
        <preu>12.95</preu>
        <stock>0</stock>
    </producte>
    <producte id="p3" categoria="alimentacio" moneda="EUR">
        <nom>Oli d'oliva verge extra</nom>
        <marca>Borges</marca>
        <preu>8.50</preu>
        <stock>200</stock>
        <etiquetes>
            <etiqueta>eco</etiqueta>
        </etiquetes>
    </producte>
    <!-- Fragment 1 (Correcto)-->
    <producte id="p4" categoria="llar" moneda="EUR">
        <nom>Aspiradora Dyson</nom>
        <marca>Dyson</marca>
        <preu>299.00</preu>
        <stock>8</stock>
    </producte>

    <!-- Fragment 2 (Moneda no puede tener ese valor) -->
    <producte id="p5" categoria="electronica" moneda="USD">
        <nom>Auriculars Sony</nom>
        <marca>Sony</marca>
        <preu>89.99</preu>
        <stock>25</stock>
    </producte>

    <!-- Fragment 3 (Preu no puede ser negativo) -->
    <producte categoria="roba" moneda="EUR">
        <nom>Jaqueta de cuir</nom>
        <marca>Mango</marca>
        <preu>-15.00</preu>
        <stock>3</stock>
    </producte>

    <!-- Fragment 4 (Nom tiene que tener mas de tres carácteres y stock está girado con preu) -->
    <producte id="p6" categoria="alimentacio" moneda="EUR">
        <nom>Pa</nom>
        <marca>Bimbo</marca>
        <stock>50</stock>
        <preu>1.20</preu>
    </producte>
</botiga>